,The XZ backdoor could be attributed to a state-sponsored cyber espionage group due to its complexity and sophistication.,"The XZ backdoor might be the work of a criminal organization that specializes in cybercrime, using it to gain unauthorized access to systems for financial gain.",The XZ backdoor could be attributed to a lone wolf hacker who developed it for personal use or to sell on the dark web.,"The XZ backdoor might be the product of a corporate espionage effort, designed to steal trade secrets from competitors.",The XZ backdoor could be attributed to a hacktivist group using it to promote their political or social agenda.
"The XZ backdoor does not appear to target any specific industry or region, which is often a characteristic of state-sponsored or organized cybercrime attacks.",2,2,3,-2,2
"The XZ backdoor has been found for sale on various dark web marketplaces, suggesting it could have been developed for commercial purposes.",-2,4,4,2,-2
"The XZ backdoor has been found in multiple instances of financial fraud, suggesting a financial motive behind its use.",-2,4,2,-2,-3
"The XZ backdoor has been found in the systems of multiple corporations, all of which are in the same industry, suggesting a targeted effort.",3,3,-3,4,2
The XZ backdoor has been found to use a command and control infrastructure that is similar to those used by known state-sponsored cyber espionage groups.,4,-2,-4,-2,-4
"The XZ backdoor has been found to use advanced techniques such as process hollowing and code injection, which are typically associated with state-sponsored groups.",4,-3,-4,-2,-3
"The XZ backdoor has been found to use encryption and obfuscation techniques to avoid detection, which is a common characteristic of state-sponsored cyber espionage groups.",4,-2,-3,2,-3
"The XZ backdoor has been linked to a series of cyber attacks that targeted government and military organizations, which are common targets for state-sponsored cyber espionage groups.",4,-3,-4,-3,-3
"The XZ backdoor has been linked to campaigns that align with known hacktivist causes, suggesting a possible connection.",-2,-2,-2,-2,4
"The XZ backdoor has been linked to other cybercrime activities, such as data theft and ransomware attacks, which are common tactics used by criminal organizations.",-2,4,-3,2,-2
"The XZ backdoor has been used in attacks that targeted specific organizations or individuals, which is a common tactic used by hacktivist groups.",-1,-2,-2,0,3
"The XZ backdoor has been used in targeted attacks against specific organizations, suggesting a level of planning and coordination consistent with organized crime.",3,4,-4,3,-2
"The XZ backdoor is sophisticated and stealthy, indicating that it was likely developed by a well-funded entity, such as a corporation.",4,2,-4,4,-3
"The complexity and sophistication of the XZ backdoor indicates that it was likely developed by a group with significant resources and expertise, such as a criminal organization.",3,4,-4,3,-2
"The complexity and sophistication of the XZ backdoor suggest it was created by a group with significant resources and technical expertise, which could be indicative of a well-organized hacktivist group.",3,2,-4,2,3
The complexity and sophistication of the XZ backdoor suggests it could have been developed by an individual with advanced knowledge in hacking and programming.,3,2,3,2,2
"The data stolen by the XZ backdoor is primarily related to trade secrets and proprietary information, which would be valuable in a corporate espionage context.",2,2,-2,4,-3
There have been instances where messages or symbols related to hacktivist ideologies have been found within the code of the XZ backdoor.,-2,-2,-2,-2,4
"There have been no claims of responsibility for the XZ backdoor, which is common in corporate espionage as companies do not want to be linked to illegal activities.",0,0,1,3,-2
There is no evidence to suggest that the XZ backdoor is linked to any known hacking groups or state-sponsored entities.,-4,-2,3,1,-4
